{
  "id": "distributed-naruto-twice-count",
  "scopeId": "anime.naruto",
  "compatibleChallengeTypeIds": [
    "distributed-information"
  ],
  "patternId": "three-segment-race",
  "prompt": {
    "ar": "اجمعوا القوائم الخاصة واحسبوا الشخصيات المشتركة."
  },
  "answerMode": "distributed",
  "answerPayload": {
    "mode": "closest",
    "correctValue": 2,
    "acceptedTolerance": 0
  },
  "mechanicPayload": {
    "variant": "three-segment-race",
    "publicPrompt": {
      "ar": "كم شخصية وردت في قائمتين من القوائم الثلاث بالضبط؟"
    },
    "segments": [
      {
        "id": "A",
        "content": {
          "ar": "قائمتك: ناروتو، ساسكي، ساكورا."
        }
      },
      {
        "id": "B",
        "content": {
          "ar": "قائمتك: ساسكي، إيتاتشي، كاكاشي."
        }
      },
      {
        "id": "C",
        "content": {
          "ar": "قائمتك: ناروتو، نيجي، هيناتا."
        }
      }
    ],
    "twoPlayerMergeOptions": [
      {
        "firstParticipantSegmentIds": ["A", "B"],
        "secondParticipantSegmentIds": ["C"]
      },
      {
        "firstParticipantSegmentIds": ["A", "C"],
        "secondParticipantSegmentIds": ["B"]
      },
      {
        "firstParticipantSegmentIds": ["B", "C"],
        "secondParticipantSegmentIds": ["A"]
      }
    ],
    "supportedTeamSizes": [2, 3],
    "authorSafetyConfirmation": true,
    "explanation": "ناروتو وساسكي يظهران في قائمتين بالضبط، والباقون في قائمة واحدة؛ لا يمكن معرفة ذلك دون القوائم الثلاث."
  },
  "status": "ready",
  "metadata": {
    "sources": [
      "naruto.anime.main-continuity"
    ],
    "validationStatus": "ready",
    "runtimeContractStatus": "fully_playable",
    "runtimeBlocker": null
  }
}
