{
  "id": "naruto-sannin-summons",
  "scopeId": "anime.naruto",
  "compatibleChallengeTypeIds": ["distributed-information"],
  "patternId": "three-segment-race",
  "prompt": {"ar": "اجمعوا معلوماتكم واختاروا الإجابة الصحيحة.", "en": "Combine your information and select the correct answer."},
  "answerMode": "distributed",
  "answerPayload": {
    "mode": "multiple_choice",
    "correctOptionId": "n1",
    "options": [
      {"id": "n0", "label": {"ar": "0"}},
      {"id": "n1", "label": {"ar": "1"}},
      {"id": "n2", "label": {"ar": "2"}},
      {"id": "n3", "label": {"ar": "3"}}
    ]
  },
  "mechanicPayload": {
    "variant": "three-segment-race",
    "publicPrompt": {"ar": "كم عدد السانين الثلاثة الذين حيوان استدعائهم من الأفاعي؟"},
    "segments": [
      {"id": "A", "content": {"ar": "جيرايا يستدعي الضفادع، وتسونادي تستدعي البزاقات."}},
      {"id": "B", "content": {"ar": "أوروتشيمارو يستدعي الأفاعي."}},
      {"id": "C", "content": {"ar": "قاعدة الحساب: يُحسب السانين فقط إذا كان حيوان استدعائه من الأفاعي تحديدًا، ولا تُحسب الضفادع ولا البزاقات."}}
    ],
    "twoPlayerMergeOptions": [
      {"firstParticipantSegmentIds": ["A", "C"], "secondParticipantSegmentIds": ["B"]},
      {"firstParticipantSegmentIds": ["A", "B"], "secondParticipantSegmentIds": ["C"]}
    ],
    "supportedTeamSizes": [2, 3],
    "authorSafetyConfirmation": true,
    "explanation": "راجعت التوزيع، ولا يستطيع لاعب واحد حل اللغز بمفرده."
  },
  "status": "draft",
  "metadata": {
    "sources": ["Naruto anime canon: Sannin summons — Jiraiya toads (Gamabunta), Tsunade slugs (Katsuyu), Orochimaru snakes (Manda)"],
    "validationStatus": "draft",
    "runtimeContractStatus": "fully_playable",
    "runtimeBlocker": null
  }
}
