{
  "id": "distributed-naruto-rasengan",
  "scopeId": "anime.naruto",
  "compatibleChallengeTypeIds": [
    "distributed-information"
  ],
  "patternId": "three-segment-race",
  "prompt": {
    "ar": "حلّوا ألغازكم الفردية، وأعلنوا الحل الذي استخرجتموه، ثم اجمعوا الحلول الثلاثة."
  },
  "answerMode": "distributed",
  "answerPayload": {
    "mode": "multiple_choice",
    "correctOptionId": "a",
    "options": [
      {
        "id": "a",
        "label": {
          "ar": "الراسنغان"
        }
      },
      {
        "id": "b",
        "label": {
          "ar": "التشيدوري"
        }
      },
      {
        "id": "c",
        "label": {
          "ar": "نسخ الظل"
        }
      },
      {
        "id": "d",
        "label": {
          "ar": "الراسنشوريكين"
        }
      }
    ]
  },
  "mechanicPayload": {
    "variant": "three-segment-race",
    "publicPrompt": {
      "ar": "كل لاعب يحلّ لغزه الخاص وحده، ثم يعلن حلَّه. اجمعوا الحلول الثلاثة واختاروا من الخيارات التقنيةَ الوحيدة التي تجمعها الدلائل كلها."
    },
    "segments": [
      {
        "id": "A",
        "content": {
          "ar": "لغزك الخاص: رتّب فنونَ الأشقر بحسب أقدميةِ تعلّمها: تقنيةٌ لقّنها إيّاه معلّمُه الأقنع فأدّى العجلةَ الأولى بيدٍ لا تعرف، ثم فنونٌ انبثّت عنه أشباحٌ يملؤون الميدان، ثم أسلوبٌ أضفاه على نسخةٍ أعظم فاتسع شررُه. في ترتيبها هذا: أيُّ التقنيات المذكورة في الخيارات استخدمها الأشقر فعلًا؟ حلُّ اللغز هو الدليل الذي ستعلنه."
        }
      },
      {
        "id": "B",
        "content": {
          "ar": "لغزك الخاص: قارن التقنيات بجزأي الحكاية: بعضُها افتتح البطولةَ الأولى فظهر في الجزء الأول — أسلوبٌ دائريٌّ يدور في كفٍّ، وأسلوبُ برقٍ يسري بين أصابعَ لمُدارس، وفنونُ انشقاقٍ يتكاثر بها الواحد — وبعضُها انتظر الجزء الثاني ليقف على مسرحه. أيُّ التقنيات ظهرت منذ الجزء الأول؟ حلُّ اللغز هو الدليل الذي ستعلنه."
        }
      },
      {
        "id": "C",
        "content": {
          "ar": "لغزك الخاص: نمطٌ يتكرّر في هذه الأساليب: شاكرا تُدار في نقطةٍ واحدةٍ فتُعصر حتى تكاد تنفلت، ثم تندفع دفعةً واحدةً صوب الهدف — بلا فروعٍ ولا امتدادٍ ولا أثرٍ جانبي. ما الصفة الجامعة لهذه التقنيات الهجومية المركّزة؟ حلُّ اللغز هو الدليل الذي ستعلنه."
        }
      }
    ],
    "twoPlayerMergeOptions": [
      {
        "firstParticipantSegmentIds": [
          "A",
          "B"
        ],
        "secondParticipantSegmentIds": [
          "C"
        ]
      },
      {
        "firstParticipantSegmentIds": [
          "A",
          "C"
        ],
        "secondParticipantSegmentIds": [
          "B"
        ]
      },
      {
        "firstParticipantSegmentIds": [
          "B",
          "C"
        ],
        "secondParticipantSegmentIds": [
          "A"
        ]
      }
    ],
    "supportedTeamSizes": [
      2,
      3
    ],
    "authorSafetyConfirmation": true,
    "explanation": "ألغازٌ مستقلة تُحلّ بمعرفة عالم ناروتو. أ: استخدمها ناروتو (ترتيب زمني)، ب: ظهرت في الجزء الأول (مطابقة)، ج: تقنية هجومية مركّزة (نمط تركيز). أي دليلين يبقيان خيارين (ناروتو+الجزء الأول: الراسنغان/نسخ الظل، ناروتو+التركيز: الراسنغان/الراسنشوريكين، الجزء الأول+التركيز: الراسنغان/التشيدوري)، والثلاثة تفرد الراسنغان. لا عدّ ولا جمع."
  },
  "status": "ready",
  "metadata": {
    "sources": [
      "naruto.anime.main-continuity"
    ],
    "validationStatus": "ready",
    "runtimeContractStatus": "fully_playable",
    "runtimeBlocker": null
  }
}
