{
  "id": "naruto-rookie-team-leaders",
  "scopeId": "anime.naruto",
  "compatibleChallengeTypeIds": ["distributed-information"],
  "patternId": "three-segment-race",
  "prompt": {"ar": "اجمعوا قوائمكم وحددوا عدد القادة.", "en": "Combine your lists and determine the number of leaders."},
  "answerMode": "distributed",
  "answerPayload": {"mode": "closest", "correctValue": 4, "acceptedTolerance": 0},
  "mechanicPayload": {
    "variant": "three-segment-race",
    "publicPrompt": {"ar": "كم عدد القادة (معلمي الفرق) بين الشخصيات المذكورة في بطاقاتكم؟"},
    "segments": [
      {"id": "A", "content": {"ar": "لديك: كاكاشي (قائد فريق)، ناروتو (عضو)، ساكورا (عضو)."}},
      {"id": "B", "content": {"ar": "لديك: أسوما (قائد فريق)، غاي (قائد فريق)، إينو (عضو)، تشوجي (عضو)."}},
      {"id": "C", "content": {"ar": "لديك: كوريناي (قائدة فريق)، شيكامارو (عضو)، هيناتا (عضو)، كيبا (عضو)."}}
    ],
    "twoPlayerMergeOptions": [
      {"firstParticipantSegmentIds": ["A", "C"], "secondParticipantSegmentIds": ["B"]},
      {"firstParticipantSegmentIds": ["A", "B"], "secondParticipantSegmentIds": ["C"]}
    ],
    "supportedTeamSizes": [2, 3],
    "authorSafetyConfirmation": true,
    "explanation": "راجعت التوزيع، ولا يستطيع لاعب واحد حل اللغز بمفرده."
  },
  "status": "draft",
  "metadata": {
    "sources": ["Naruto anime canon: Team 7 (Kakashi), Team 8 (Kurenai), Team 10 (Asuma), Team Guy (Might Guy)"],
    "validationStatus": "draft",
    "runtimeContractStatus": "fully_playable",
    "runtimeBlocker": null
  }
}
