{
  "id": "distributed-naruto-senju-clan",
  "scopeId": "anime.naruto",
  "compatibleChallengeTypeIds": [
    "distributed-information"
  ],
  "patternId": "three-segment-race",
  "prompt": {
    "ar": "حلّوا ألغازكم الفردية، وأعلنوا الحل الذي استخرجتموه، ثم اجمعوا الحلول الثلاثة."
  },
  "answerMode": "distributed",
  "answerPayload": {
    "mode": "multiple_choice",
    "correctOptionId": "c",
    "options": [
      {
        "id": "a",
        "label": {
          "ar": "عشيرة الأوتشيها"
        }
      },
      {
        "id": "b",
        "label": {
          "ar": "عشيرة الساروتوبي"
        }
      },
      {
        "id": "c",
        "label": {
          "ar": "عشيرة السينجو"
        }
      },
      {
        "id": "d",
        "label": {
          "ar": "عشيرة الأوزوماكي"
        }
      }
    ]
  },
  "mechanicPayload": {
    "variant": "three-segment-race",
    "publicPrompt": {
      "ar": "كل لاعب يحلّ لغزه الخاص وحده، ثم يعلن حلَّه. اجمعوا الحلول الثلاثة واختاروا من الخيارات العشيرةَ الوحيدة التي تجمعها الدلائل كلها."
    },
    "segments": [
      {
        "id": "A",
        "content": {
          "ar": "لغزك الخاص: رمزُ القرية ورقةٌ خضراءُ على جبين كلّ نينجا ينتمي إليها؛ عشائرُ بنت هذه القريةَ وأقامت فيها: عشيرةٌ منها هاشيراما مؤسّسُ القرية، وعشيرةٌ أوكلت إليها القريةُ شرطتَها، وعشيرةٌ وُلد فيها الهوكاجي الثالث. وأمّا عشيرةٌ رابعةٌ فموطنُها قريةٌ ساحليةٌ سُمّيت بالزوابع. ما الصفة الجامعة للعشائر الثلاث الأولى؟ حلُّ اللغز هو الدليل الذي ستعلنه."
        }
      },
      {
        "id": "B",
        "content": {
          "ar": "لغزك الخاص: استبعد من بين العشائر ما لم يجلس أحدُ أبنائها في مقعد القائد الأعلى، ثم انظر إلى ما بقي: أيُّ العشائر أنجبت من بلغ منصبَ الهوكاجي؟ حلُّ اللغز هو الدليل الذي ستعلنه."
        }
      },
      {
        "id": "C",
        "content": {
          "ar": "لغزك الخاص: علاقةُ دمٍ تنتقل في الأبناء قوةً موروثةً لا تُدرّس: عينٌ تحمرّ عند صاحبها حين يشتدّ قلبُه، وسلاسلُ طاقةٍ تخرجُ من خلفِ ظهرٍ يحمي قريبَه، وخشبٌ أخضرُ ينبتُ من يدَي مؤسّسٍ يحيي به الأرضَ بعدَ الموت. أيُّ العشائر اتصفت بقوةٍ فطريةٍ مميزةٍ في دمها؟ حلُّ اللغز هو الدليل الذي ستعلنه."
        }
      }
    ],
    "twoPlayerMergeOptions": [
      {
        "firstParticipantSegmentIds": [
          "A",
          "B"
        ],
        "secondParticipantSegmentIds": [
          "C"
        ]
      },
      {
        "firstParticipantSegmentIds": [
          "A",
          "C"
        ],
        "secondParticipantSegmentIds": [
          "B"
        ]
      },
      {
        "firstParticipantSegmentIds": [
          "B",
          "C"
        ],
        "secondParticipantSegmentIds": [
          "A"
        ]
      }
    ],
    "supportedTeamSizes": [
      2,
      3
    ],
    "authorSafetyConfirmation": true,
    "explanation": "ألغازٌ مستقلة تُحلّ بمعرفة عالم ناروتو. أ: تنتمي إلى قرية الأوراق (انتماء)، ب: أنجبت الهوكاجي (استبعاد)، ج: قوةٌ موروثةٌ في دمها (مطابقة). أي دليلين يبقيان خيارين (الانتماء+الهوكاجي: ساروتوبي/سينجو، الانتماء+الدم: أوتشيها/سينجو، الهوكاجي+الدم: سينجو/أوزوماكي)، والثلاثة تفرد السينجو. لا عدّ ولا جمع."
  },
  "status": "ready",
  "metadata": {
    "sources": [
      "naruto.anime.main-continuity"
    ],
    "validationStatus": "ready",
    "runtimeContractStatus": "fully_playable",
    "runtimeBlocker": null
  }
}
