{
  "id": "distributed-naruto-konoha-crush",
  "scopeId": "anime.naruto",
  "compatibleChallengeTypeIds": [
    "distributed-information"
  ],
  "patternId": "three-segment-race",
  "prompt": {
    "ar": "حلّوا ألغازكم الفردية، وأعلنوا الحل الذي استخرجتموه، ثم اجمعوا الحلول الثلاثة."
  },
  "answerMode": "distributed",
  "answerPayload": {
    "mode": "multiple_choice",
    "correctOptionId": "a",
    "options": [
      {
        "id": "a",
        "label": {
          "ar": "غزو قرية الأوراق"
        }
      },
      {
        "id": "b",
        "label": {
          "ar": "مطاردة ساسكي"
        }
      },
      {
        "id": "c",
        "label": {
          "ar": "مهمة أرض الأمواج"
        }
      },
      {
        "id": "d",
        "label": {
          "ar": "مجزرة عشيرة الأوتشيها"
        }
      }
    ]
  },
  "mechanicPayload": {
    "variant": "three-segment-race",
    "publicPrompt": {
      "ar": "كل لاعب يحلّ لغزه الخاص وحده، ثم يعلن حلَّه. اجمعوا الحلول الثلاثة واختاروا من الخيارات الحدثَ الوحيد الذي تجمعه الدلائل كلها."
    },
    "segments": [
      {
        "id": "A",
        "content": {
          "ar": "لغزك الخاص: رتّب محطّاتِ حياة الأشقر زمنيًّا: جسرٌ شُدّ في بلادٍ غريبةٍ بعيدة، ثم امتحانٌ أُقيم في قريته فكاد يُحيلها رمادًا، ثم طريدٌ غادر قريتَه فخرج الأشقر وأصحابُه يلاحقونه عبر الحدود. في أيٍّ من هذه المحطّات كان الأشقر حاضرًا بقوامه لا بذكره فقط؟ ما الصفة الجامعة بين المحطّات التي شارك فيها بنفسه؟ حلُّ اللغز هو الدليل الذي ستعلنه."
        }
      },
      {
        "id": "B",
        "content": {
          "ar": "لغزك الخاص: استنتج من العواقب: أيُّ أحداثٍ خلّفت أثرًا في قلبِ القرية أو في مصير عشائرها؟ تهديدٌ أطاح بقائدِها في عقر داره، وفرارُ نجلِ عشيرتِها عن طوعه، وانطفاءُ عشيرةٍ كاملةٍ في ليلةٍ من ليلها. ما الصفة الجامعة لهذه الأحداث المتّصلة بالقرية؟ حلُّ اللغز هو الدليل الذي ستعلنه."
        }
      },
      {
        "id": "C",
        "content": {
          "ar": "لغزك الخاص: أحداثٌ غيّرت ملامحَ الحكاية؛ سقط في بعضها عظماءُ فأبكت القريةَ دمعةً لا تُنسى: حارسٌ يُعانق الأرض في معركةٍ بالغة، وزوجٌ يضمّ صاحبه بعد أن كانا متخاصمين، وعشيرةٌ انطفأت بيدِ من يجب أن يحميها. ما الصفة الجامعة للأحداث التي شهدت موت شخصياتٍ بارزة؟ حلُّ اللغز هو الدليل الذي ستعلنه."
        }
      }
    ],
    "twoPlayerMergeOptions": [
      {
        "firstParticipantSegmentIds": [
          "A",
          "B"
        ],
        "secondParticipantSegmentIds": [
          "C"
        ]
      },
      {
        "firstParticipantSegmentIds": [
          "A",
          "C"
        ],
        "secondParticipantSegmentIds": [
          "B"
        ]
      },
      {
        "firstParticipantSegmentIds": [
          "B",
          "C"
        ],
        "secondParticipantSegmentIds": [
          "A"
        ]
      }
    ],
    "supportedTeamSizes": [
      2,
      3
    ],
    "authorSafetyConfirmation": true,
    "explanation": "ألغازٌ مستقلة تُحلّ بمعرفة عالم ناروتو. أ: شارك فيه ناروتو (ترتيب زمني)، ب: مسّ مصير القرية أو عشائرها (استنتاج)، ج: شهد موت شخصياتٍ بارزة (تحوّل). أي دليلين يبقيان خيارين (المشاركة+المصير: الغزو/المطاردة، المشاركة+الموت: الغزو/مهمة أرض الأمواج، المصير+الموت: الغزو/المجزرة)، والثلاثة تفرد الغزو. لا عدّ ولا جمع."
  },
  "status": "ready",
  "metadata": {
    "sources": [
      "naruto.anime.main-continuity"
    ],
    "validationStatus": "ready",
    "runtimeContractStatus": "fully_playable",
    "runtimeBlocker": null
  }
}
